Poids,Volume,Conductivite,Opacite,Rigidite,Categorie,Source,Rapport_Collecte,Prix_Revente_Reel,Prix_Revente_Predit
38.760467925297945,106.97434936561552,0.0,0.5960435384347462,4.0,Plastique,Usine_A,"Déchets plastiques divers provenant de l'Usine A. Poids estimé 38.8 kg. Opacité semi-opaque, souplesse variable. Légère contamination observée.",3.876046792529795,6.346316586397982
11.767135578787368,1.9033110852868376,0.0,1.0,1.0,Papier,Usine_B,"Collecte de déchets papier depuis l'Usine B. Masse 11.8 kg. Matériau souple, sans conductivité électrique. Surface très opaque.",0.5883567789393684,8.764573320248452
185.0721758836556,362.13016561764977,0.0,0.0049932444240114,10.0,Verre,Collecte_Citoyenne,Lot de verre trié issu de la collecte citoyenne. Masse 185.1 kg. Matériau lourd et extrêmement rigide. Aspect légèrement translucide. Légère contamination observée.,5.552165276509668,21.031943425582536
13.805435790079857,56.21398431135728,0.0,1.0,3.0,Papier,Usine_A,"Déchet de type papier identifié à l'Usine A. Volume estimé 56.2 L, poids 13.8 kg. Texture semi-rigide, très opaque.",0.6902717895039929,4.408135927853682
13.943319572245038,25.53862196139088,0.0,1.0,1.0,Papier,Collecte_Citoyenne,"Papier usagé lors d'une collecte citoyenne. Poids relevé : 13.9 kg. Faible rigidité, non conducteur. Traces d'humidité détectées.",0.6971659786122519,8.764573320248452
19.109198838521955,35.101968190461854,0.0,0.5831736484227081,5.0,Plastique,Usine_A,"Plastique de tri sélectif en provenance de l'Usine A. Masse 19.1 kg. Matériau rigide, faible conductivité. Traces d'humidité détectées.",1.910919883852196,2.335254379514198
228.46127068408325,450.4761319839397,0.0,0.1302295169763348,9.0,Verre,Centre_Tri,"Déchet en verre collecté au centre de tri municipal. Poids lourd : 228.5 kg, volume 450.5 L. Très rigide, non conducteur, aspect légèrement translucide.",6.853838120522497,-1.859325908218092
19.906570639993905,64.5273760659646,0.0,1.0,3.0,Papier,,"Papier usagé dans un site non renseigné. Poids relevé : 19.9 kg. Faible rigidité, non conducteur. Lot conforme aux standards de tri.",0.9953285319996952,6.346316586397982
18.10588107132672,69.06522120777271,0.0,0.4852827533130471,,Plastique,,"Déchets plastiques divers sans localisation enregistrée. Poids estimé 18.1 kg. Opacité semi-opaque, souplesse variable. Matériau mélangé à d'autres déchets.",1.810588107132672,6.346316586397982
26.296766314027035,35.922352882468736,,0.4974033025166431,5.0,,Usine_B,"Déchet non catégorisé collecté en provenance de l'Usine B. Poids 26.3 kg, volume 35.9 L. Caractéristiques ambiguës. Nécessite analyse complémentaire.",2.629676631402704,2.335254379514198
28.328782862135885,62.309164734037765,0.0,0.5020167714985113,3.0,Plastique,Collecte_Citoyenne,"Lot plastique issu de la collecte citoyenne. Volume 62.3 L, poids 28.3 kg. Aspect semi-opaque, rigidité moyenne. Aucune trace de métal.",2.832878286213589,6.346316586397982
44.89045173884479,107.33740684729185,0.0,,4.0,Plastique,Centre_Tri,"Lot plastique depuis le Centre de Tri. Volume 107.3 L, poids 44.9 kg. Aspect indéterminée, rigidité moyenne. Aucune trace de métal.",4.489045173884479,6.346316586397982
,417.2303858826962,0.0,0.1229956480682264,9.0,Verre,Usine_B,"Déchet en verre collecté depuis l'Usine B. Poids lourd : non mesuré kg, volume 417.2 L. Très rigide, non conducteur, aspect légèrement translucide.",6.083289899927849,9.40226813262006
158.01739110930012,302.00134401811874,0.0,0.0347505191324589,9.0,Verre,Usine_A,"Déchet en verre collecté provenant de l'Usine A. Poids lourd : 158.0 kg, volume 302.0 L. Très rigide, non conducteur, aspect légèrement translucide.",4.740521733279003,2.0937089267050517
,66.93942942774491,0.0,0.5359445211466881,,,Usine_B,Déchet inclassifiable détecté en provenance de l'Usine B. Masse estimée non mesuré kg. Agent de tri recommande contrôle visuel supplémentaire. Étiquetage absent sur le conteneur.,1.5973947282003067,6.346316586397982
,76.72207090402637,0.0,1.0,1.0,,Usine_B,"Déchet non catégorisé collecté en provenance de l'Usine B. Poids non mesuré kg, volume 76.7 L. Caractéristiques ambiguës. Nécessite analyse complémentaire.",1.087331265736461,14.713816185676535
14.34480796500502,-12.015188882500034,0.0,,3.0,Papier,Centre_Tri,"Papier usagé depuis le Centre de Tri. Poids relevé : 14.3 kg. Faible rigidité, non conducteur. Odeur inhabituelle signalée par l'agent.",0.7172403982502511,0.3970737209698968
,66.93942942774491,0.0,,,Plastique,Usine_B,"Plastique de tri sélectif à l'Usine B. Masse non mesuré kg. Matériau de rigidité non mesurée, faible conductivité. Légère contamination observée.",1.5973947282003067,-11.487927903602866
23.829095917131248,,0.0,0.3951239203234952,4.0,Plastique,Usine_B,"Déchet plastique collecté à l'Usine B. Poids 23.8 kg, volume non mesuré L. Rigidité semi-rigide, non conducteur. Surface légèrement translucide.",2.382909591713125,6.346316586397982
,168.7725383285809,0.846885120002303,1.0,9.0,Métal,Collecte_Citoyenne,Déchets métalliques triés via la collecte citoyenne. Poids non mesuré kg. Conductivité mesurée : 0.847. Matériau dense et résistant. Poids anormalement élevé pour cette catégorie.,24.902347234644783,6.346316586397982
66.07371148438695,131.30070980480914,0.8206242724816152,1.0,8.0,Métal,Usine_A,"Déchets métalliques triés en provenance de l'Usine A. Poids 66.1 kg. Conductivité mesurée : 0.821. Matériau dense et résistant. Volume surestimé, vérification recommandée.",19.822113445316084,6.346316586397982
185.2445330642633,373.782169235698,0.0,0.1496711707331479,8.0,Verre,Usine_A,Lot de verre trié en provenance de l'Usine A. Masse 185.2 kg. Matériau lourd et extrêmement rigide. Aspect légèrement translucide. Odeur inhabituelle signalée par l'agent.,5.557335991927899,-1.859325908218092
29.15437000856192,44.863174573371865,0.0,0.3102191756877933,3.0,Plastique,Centre_Tri,"Déchets plastiques divers depuis le Centre de Tri. Poids estimé 29.2 kg. Opacité légèrement translucide, souplesse variable. État dégradé, recyclage partiel possible.",2.9154370008561923,6.346316586397982
28.25362148190069,,0.0,0.5266892810234178,4.0,Plastique,Collecte_Citoyenne,"Emballages plastiques récupérés issu de la collecte citoyenne. Masse 28.3 kg, volume non mesuré L. semi-rigide, non conducteur.",2.82536214819007,6.346316586397982
22.242852868556326,17.32988783195512,0.8988295341275766,1.0,8.0,Métal,Usine_B,"Déchet métallique détecté en provenance de l'Usine B. Poids 22.2 kg, volume 17.3 L. Conductivité élevée (0.899), rigidité importante. Aucune anomalie signalée.",6.672855860566898,56.794705157230396
196.0351694544165,409.82344742630977,0.0,0.1428653271469995,10.0,Verre,Collecte_Citoyenne,"Bris de verre ou contenants lors d'une collecte citoyenne. Masse 196.0 kg. Matériau dense, rigidité élevée, transparence partielle. Aucune anomalie signalée.",5.881055083632496,7.228197513531615
29.26027136405622,57.00723064159583,0.0,0.3731085937367275,3.0,Plastique,Centre_Tri,"Emballages plastiques récupérés depuis le Centre de Tri. Masse 29.3 kg, volume 57.0 L. semi-rigide, non conducteur.",2.9260271364056223,6.346316586397982
42.14722059686548,66.67716830396574,0.0,0.4774870429613354,5.0,Plastique,Centre_Tri,"Lot plastique au Centre de Tri. Volume 66.7 L, poids 42.1 kg. Aspect semi-opaque, rigidité moyenne. Aucune trace de métal.",4.214722059686548,6.346316586397982
9.386745440588584,29.79322403260344,0.0,,4.0,Plastique,Centre_Tri,"Lot plastique au Centre de Tri. Volume 29.8 L, poids 9.4 kg. Aspect indéterminée, rigidité moyenne. Aucune trace de métal.",0.9386745440588584,0.3970737209698968
15.696712968106322,40.44412377263934,0.0,1.0,1.0,Papier,Collecte_Citoyenne,"Papier usagé via la collecte citoyenne. Poids relevé : 15.7 kg. Faible rigidité, non conducteur. Volume surestimé, vérification recommandée.",0.7848356484053162,8.764573320248452
21.690576082238405,75.10862976765713,0.0,1.0,3.0,,Centre_Tri,"Lot de déchets non identifiés au centre de tri municipal. Masse 21.7 kg. Comportement physique atypique, classification incertaine. Légère contamination observée.",1.0845288041119203,6.346316586397982
75.87310570415862,170.49741385241254,0.9124145588805144,1.0,9.0,Métal,Usine_B,"Métal de récupération depuis l'Usine B. Masse 75.9 kg. Forte conductivité (0.912), rigidité élevée. Bonne valeur marchande.",22.761931711247584,6.346316586397982
1342.0344414906758,267.24879015137947,,0.1975336015993294,8.0,Verre,Centre_Tri,"Déchets en verre identifiés au centre de tri municipal. Poids 1342.0 kg, volume 267.2 L. Non conducteur, très rigide. Nécessite manipulation avec précaution.",4.026103324472028,76.68916501443235
46.51823927515308,66.43020603552637,0.97881886050665,1.0,9.0,Métal,Usine_A,"Métal de récupération à l'Usine A. Masse 46.5 kg. Forte conductivité (0.979), rigidité élevée. Bonne valeur marchande.",13.955471782545922,6.346316586397982
,72.22353483783024,0.0,0.4406447280585325,4.0,Plastique,Usine_B,"Emballages plastiques récupérés en provenance de l'Usine B. Masse non mesuré kg, volume 72.2 L. semi-rigide, non conducteur.",3.4719613332466093,6.346316586397982
224.8802163815153,458.90503025958446,0.0,0.019774723528127,10.0,Verre,Usine_B,"Verre recyclable en provenance de l'Usine B. Poids 224.9 kg, volume 458.9 L. Rigidité extrêmement rigide, faible conductivité. Surface lisse.",6.74640649144546,7.228197513531615
9.083707436671125,-22.61722868185976,0.0,1.0,3.0,Papier,Centre_Tri,"Papier usagé depuis le Centre de Tri. Poids relevé : 9.1 kg. Faible rigidité, non conducteur. Acheminement prioritaire demandé.",0.4541853718335562,0.3970737209698968
20.21304417818244,30.0290205253898,0.0,1.0,2.0,Papier,Centre_Tri,"Papier usagé depuis le Centre de Tri. Poids relevé : 20.2 kg. Faible rigidité, non conducteur. Étiquetage absent sur le conteneur.",1.010652208909122,2.335254379514198
28.36532663297793,33.827104785248245,0.0,0.4351537484441548,3.0,Plastique,,"Emballages plastiques récupérés dans un site non renseigné. Masse 28.4 kg, volume 33.8 L. semi-rigide, non conducteur.",2.836532663297793,119.41716566606188
12.91902797557373,3.2366691703403063,0.0,1.0,2.0,Papier,Usine_B,"Collecte de déchets papier depuis l'Usine B. Masse 12.9 kg. Matériau souple, sans conductivité électrique. Surface très opaque.",0.6459513987786866,0.3970737209698968
12.20502636059001,31.21124005839605,0.0,1.0,,Papier,Usine_A,"Lot de papier récupéré à l'Usine A. Poids léger de 12.2 kg, volume petit. Matériau souple, non conducteur, aspect très opaque. Bon état général.",0.6102513180295005,-0.34948663464006346
203.69700240113625,399.56549446853774,0.0,0.0751344503763453,9.0,Verre,Collecte_Citoyenne,"Verre recyclable via la collecte citoyenne. Poids 203.7 kg, volume 399.6 L. Rigidité extrêmement rigide, faible conductivité. Surface lisse.",6.110910072034086,-1.859325908218092
267.0726292944182,,0.0,0.2662082041469159,4.0,Plastique,,"Plastique de tri sélectif dans un site non renseigné. Masse 267.1 kg. Matériau semi-rigide, faible conductivité. Matériau mélangé à d'autres déchets.",2.6707262929441824,68.88678921992695
38.67849036663182,58.62670038332891,0.0,0.4371851621035286,3.0,Plastique,Usine_A,"Emballages plastiques récupérés à l'Usine A. Masse 38.7 kg, volume 58.6 L. semi-rigide, non conducteur.",3.8678490366631824,6.346316586397982
,150.91194865864708,0.9619059951536884,1.0,9.0,Métal,Centre_Tri,"Ferraille ou métal collecté au Centre de Tri. Masse non mesuré kg. Haute conductivité électrique, matériau extrêmement rigide. Prix revente estimé.",19.96000131768666,6.346316586397982
,53.21313905939869,0.0,,4.0,Plastique,Collecte_Citoyenne,"Emballages plastiques récupérés via la collecte citoyenne. Masse non mesuré kg, volume 53.2 L. semi-rigide, non conducteur.",2.683234894064353,6.346316586397982
28.919623002107496,56.46342907551743,,0.5106894521886771,3.0,Plastique,Collecte_Citoyenne,"Plastique de tri sélectif lors d'une collecte citoyenne. Masse 28.9 kg. Matériau semi-rigide, faible conductivité. État dégradé, recyclage partiel possible.",2.89196230021075,8.119274958736018
37.10593504916682,74.86338164650488,0.8077859926651335,1.0,8.0,Métal,Usine_A,"Déchet métallique détecté provenant de l'Usine A. Poids 37.1 kg, volume 74.9 L. Conductivité élevée (0.808), rigidité importante. Volume surestimé, vérification recommandée.",11.131780514750044,6.346316586397982
23.43089399502526,16.09438801068846,0.0,0.2410993009809693,3.0,Plastique,Collecte_Citoyenne,"Plastique de tri sélectif lors d'une collecte citoyenne. Masse 23.4 kg. Matériau semi-rigide, faible conductivité. Traces d'humidité détectées.",2.343089399502526,2.335254379514198
23.275321506294844,33.448447668771045,0.0,0.406069472962725,3.0,Plastique,Usine_A,"Emballages plastiques récupérés provenant de l'Usine A. Masse 23.3 kg, volume 33.4 L. semi-rigide, non conducteur.",2.3275321506294846,-53.083260321524016
27.775251032217348,96.48774597882586,0.0,0.5238700145063557,4.0,Plastique,Usine_B,"Déchet plastique collecté depuis l'Usine B. Poids 27.8 kg, volume 96.5 L. Rigidité semi-rigide, non conducteur. Surface semi-opaque.",2.777525103221735,6.346316586397982
200.70710401140812,350.2468403576744,,0.0109268840001944,9.0,Verre,Centre_Tri,"Lot de verre trié au centre de tri municipal. Masse 200.7 kg. Matériau lourd et extrêmement rigide. Aspect légèrement translucide. Volume surestimé, vérification recommandée.",6.021213120342245,-9.167885114133105
37.00896946656361,94.67703359769948,0.9668606731909536,1.0,7.0,Métal,Usine_A,"Déchet métallique détecté provenant de l'Usine A. Poids 37.0 kg, volume 94.7 L. Conductivité élevée (0.967), rigidité importante. Odeur inhabituelle signalée par l'agent.",11.102690839969084,6.346316586397982
27.775251032217348,96.48774597882586,0.0,0.5238700145063557,4.0,Plastique,Usine_B,"Plastique de tri sélectif à l'Usine B. Masse 27.8 kg. Matériau semi-rigide, faible conductivité. État dégradé, recyclage partiel possible.",2.777525103221735,16.51289165168153
218.60924891548785,428.32574666606286,0.0,0.0299834854697547,10.0,Verre,Usine_A,Lot de verre trié provenant de l'Usine A. Masse 218.6 kg. Matériau lourd et extrêmement rigide. Aspect légèrement translucide. Acheminement prioritaire demandé.,6.5582774674646345,64.97013400916072
148.7912481531717,302.3909938431191,0.0,0.0887718376842602,10.0,Verre,Collecte_Citoyenne,"Bris de verre ou contenants lors d'une collecte citoyenne. Masse 148.8 kg. Matériau dense, rigidité élevée, transparence partielle. Lot conforme aux standards de tri.",4.463737444595151,7.3987359225736276
7.543328010061639,-2.4807677217324056,0.0,,3.0,Plastique,Collecte_Citoyenne,"Déchets plastiques divers lors d'une collecte citoyenne. Poids estimé 7.5 kg. Opacité indéterminée, souplesse variable. Volume surestimé, vérification recommandée.",0.754332801006164,0.3970737209698968
11.2899693217118,14.220668566650703,0.0,1.0,3.0,Papier,Usine_B,"Lot de papier récupéré en provenance de l'Usine B. Poids léger de 11.3 kg, volume petit. Matériau souple, non conducteur, aspect très opaque. Bon état général.",0.56449846608559,2.1700320933079307
156.96712968106323,40.44412377263934,0.0,1.0,1.0,Papier,Collecte_Citoyenne,"Feuilles et cartons collectés issu de la collecte citoyenne. Masse totale 157.0 kg. Matériau léger, souple et opaque. Conditionnement non conforme au protocole.",0.7848356484053162,10.702753978792753
32.91449923211806,51.21535918816051,0.0,0.5771324565653047,4.0,Plastique,Usine_B,"Emballages plastiques récupérés depuis l'Usine B. Masse 32.9 kg, volume 51.2 L. semi-rigide, non conducteur.",3.291449923211806,6.346316586397982
,158.3529208583135,0.8392491433412331,1.0,10.0,Métal,Centre_Tri,"Déchet métallique détecté au centre de tri municipal. Poids non mesuré kg, volume 158.4 L. Conductivité élevée (0.839), rigidité importante. Poids anormalement élevé pour cette catégorie.",22.70362956692885,11.651343582266561
,96.2966874776256,0.0,0.4394251972871039,5.0,Plastique,Centre_Tri,"Déchet plastique collecté depuis le Centre de Tri. Poids non mesuré kg, volume 96.3 L. Rigidité rigide, non conducteur. Surface semi-opaque.",4.241147343878727,6.346316586397982
29.76447849125762,56.041871824458525,0.0,,5.0,Plastique,Usine_A,"Lot plastique provenant de l'Usine A. Volume 56.0 L, poids 29.8 kg. Aspect indéterminée, rigidité moyenne. Aucune trace de métal.",2.976447849125762,6.346316586397982
,370.1189213045743,0.0,0.1794872296092408,10.0,Verre,Usine_B,Lot de verre trié depuis l'Usine B. Masse non mesuré kg. Matériau lourd et extrêmement rigide. Aspect légèrement translucide. Légère contamination observée.,5.552687600523766,137.5905794548502
200.3811984886951,377.7865162742171,0.0,0.148379265391743,8.0,Verre,Centre_Tri,"Déchets en verre identifiés au Centre de Tri. Poids 200.4 kg, volume 377.8 L. Non conducteur, très rigide. Nécessite manipulation avec précaution.",6.011435954660853,-1.859325908218092
26.22349138665444,,0.0,0.3685776166316989,4.0,Plastique,Centre_Tri,"Déchet plastique collecté au centre de tri municipal. Poids 26.2 kg, volume non mesuré L. Rigidité semi-rigide, non conducteur. Surface légèrement translucide.",2.6223491386654434,6.346316586397982
26.0088814779725,38.95982750771376,,0.3578304302390586,5.0,Plastique,Usine_B,"Lot plastique à l'Usine B. Volume 39.0 L, poids 26.0 kg. Aspect légèrement translucide, rigidité moyenne. Aucune trace de métal.",2.6008881477972503,2.335254379514198
12.80706396871352,,0.0,1.0,2.0,Papier,Usine_B,"Lot de papier récupéré à l'Usine B. Poids léger de 12.8 kg, volume non mesuré. Matériau souple, non conducteur, aspect très opaque. Bon état général.",0.6403531984356761,3.661575572243722
153.8659870788745,315.79977462483055,0.0,0.0059947179745355,8.0,Verre,Usine_A,"Bris de verre ou contenants provenant de l'Usine A. Masse 153.9 kg. Matériau dense, rigidité élevée, transparence partielle. Odeur inhabituelle signalée par l'agent.",4.615979612366234,2.0937089267050517
185.6149206145849,375.8283705870383,0.0,,10.0,Verre,Usine_A,Lot de verre trié en provenance de l'Usine A. Masse 185.6 kg. Matériau lourd et extrêmement rigide. Aspect indéterminée. Étiquetage absent sur le conteneur.,5.5684476184375455,44.05216118585228
11.77862409916026,50.67665590448436,0.0,,1.0,Papier,Collecte_Citoyenne,"Lot de papier récupéré via la collecte citoyenne. Poids léger de 11.8 kg, volume moyen. Matériau souple, non conducteur, aspect indéterminée. Bon état général.",0.5889312049580131,14.548593899470267
137.0544600683006,286.0544178877328,0.0,0.0711709518518422,9.0,Verre,Collecte_Citoyenne,"Déchet en verre collecté via la collecte citoyenne. Poids lourd : 137.1 kg, volume 286.1 L. Très rigide, non conducteur, aspect légèrement translucide.",4.111633802049018,2.0937089267050517
180.78367294619176,312.1964875746974,0.0,0.0794357554858422,9.0,Verre,Centre_Tri,Lot de verre trié au Centre de Tri. Masse 180.8 kg. Matériau lourd et extrêmement rigide. Aspect légèrement translucide. Légère contamination observée.,5.4235101883857535,-2.6957223884756756
-99.0,94.89473383238214,0.0,0.3747402810460718,3.0,Plastique,Usine_A,"Déchet plastique collecté en provenance de l'Usine A. Poids -99.0 kg, volume 94.9 L. Rigidité semi-rigide, non conducteur. Surface légèrement translucide.",2.972485094949364,4.408135927853682
49.82271892462381,98.8812172998212,,1.0,10.0,Métal,Collecte_Citoyenne,"Déchet métallique détecté issu de la collecte citoyenne. Poids 49.8 kg, volume 98.9 L. Conductivité élevée (non mesurée), rigidité importante. Conditionnement non conforme au protocole.",14.94681567738714,11.651343582266561
80.82873403560433,108.4704409302212,0.8881525493876457,1.0,8.0,Métal,Collecte_Citoyenne,"Ferraille ou métal collecté via la collecte citoyenne. Masse 80.8 kg. Haute conductivité électrique, matériau extrêmement rigide. Prix revente estimé.",24.2486202106813,6.346316586397982
,102.3522392837964,0.8031485825991355,1.0,9.0,Métal,Collecte_Citoyenne,Déchets métalliques triés lors d'une collecte citoyenne. Poids non mesuré kg. Conductivité mesurée : 0.803. Matériau dense et résistant. Odeur inhabituelle signalée par l'agent.,16.93693740825937,6.346316586397982
22.752502464070385,25.53792411336495,0.0,1.0,3.0,Papier,Usine_A,"Lot de papier récupéré en provenance de l'Usine A. Poids léger de 22.8 kg, volume petit. Matériau souple, non conducteur, aspect très opaque. Bon état général.",1.1376251232035193,4.10821275185223
32.806364044901365,100.7851377737054,0.0,0.5344470812828994,3.0,Plastique,Usine_A,"Emballages plastiques récupérés en provenance de l'Usine A. Masse 32.8 kg, volume 100.8 L. semi-rigide, non conducteur.",3.280636404490137,6.346316586397982
23.97352194694685,73.98402725709559,0.0,0.2275686157468875,5.0,Plastique,,"Déchets plastiques divers dans un site non renseigné. Poids estimé 24.0 kg. Opacité légèrement translucide, souplesse variable. Acheminement prioritaire demandé.",2.3973521946946845,6.346316586397982
24.10090702134244,65.08747860463322,0.0,0.2528718631015487,5.0,Plastique,Usine_B,"Plastique de tri sélectif en provenance de l'Usine B. Masse 24.1 kg. Matériau rigide, faible conductivité. Étiquetage absent sur le conteneur.",2.410090702134244,6.346316586397982
205.30242928188,420.50911762624224,0.0,0.1963597386521255,9.0,Verre,Usine_B,"Déchets en verre identifiés à l'Usine B. Poids 205.3 kg, volume 420.5 L. Non conducteur, très rigide. Nécessite manipulation avec précaution.",6.159072878456399,34.96463776410255
64.01088471107855,134.45572554607736,0.9580060872614122,,10.0,Métal,Centre_Tri,"Ferraille ou métal collecté au Centre de Tri. Masse 64.0 kg. Haute conductivité électrique, matériau extrêmement rigide. Prix revente estimé.",19.203265413323564,11.651343582266561
38.47079009985035,101.39159849743832,0.0,,3.0,Plastique,Usine_B,"Lot plastique depuis l'Usine B. Volume 101.4 L, poids 38.5 kg. Aspect indéterminée, rigidité moyenne. Aucune trace de métal.",3.847079009985035,6.346316586397982
157.9258825487151,319.9252067952921,,,10.0,Verre,Usine_A,"Verre recyclable provenant de l'Usine A. Poids 157.9 kg, volume 319.9 L. Rigidité extrêmement rigide, faible conductivité. Surface lisse.",4.737776476461453,11.651343582266561
174.12964323369144,377.8337586567407,0.0,0.1729925210230404,9.0,Verre,Usine_A,Lot de verre trié provenant de l'Usine A. Masse 174.1 kg. Matériau lourd et extrêmement rigide. Aspect légèrement translucide. Étiquetage absent sur le conteneur.,5.223889297010743,42.44373537905957
60.65669644070834,116.19657014335483,0.8506203078359218,1.0,10.0,Métal,Collecte_Citoyenne,"Métal de récupération issu de la collecte citoyenne. Masse 60.7 kg. Forte conductivité (0.851), rigidité élevée. Bonne valeur marchande.",18.1970089322125,11.651343582266561
52.98430841788715,,0.9728432355348338,1.0,8.0,Métal,Centre_Tri,Déchets métalliques triés depuis le Centre de Tri. Poids 53.0 kg. Conductivité mesurée : 0.973. Matériau dense et résistant. Étiquetage absent sur le conteneur.,15.895292525366145,6.346316586397982
35.53272688950949,61.19025493180986,,0.4081186307674616,3.0,Plastique,Centre_Tri,"Lot plastique depuis le Centre de Tri. Volume 61.2 L, poids 35.5 kg. Aspect semi-opaque, rigidité moyenne. Aucune trace de métal.",3.5532726889509494,6.346316586397982
28.919623002107496,56.46342907551743,0.0,0.5106894521886771,3.0,Plastique,Collecte_Citoyenne,"Déchet plastique collecté via la collecte citoyenne. Poids 28.9 kg, volume 56.5 L. Rigidité semi-rigide, non conducteur. Surface semi-opaque.",2.89196230021075,6.346316586397982
43.56633382183454,32.88285780670961,0.0,0.4578186602503288,4.0,,Collecte_Citoyenne,"Matériau inconnu lors d'une collecte citoyenne. Poids 43.6 kg, volume 32.9 L. Propriétés mixtes. Orientation vers tri manuel.",4.356633382183454,2.335254379514198
11.983960519411893,11.237406575311736,0.0,1.0,1.0,Papier,Collecte_Citoyenne,"Lot de papier récupéré via la collecte citoyenne. Poids léger de 12.0 kg, volume petit. Matériau souple, non conducteur, aspect très opaque. Bon état général.",0.5991980259705946,10.537531692586485
16.246918418553776,64.04290243237705,0.0,1.0,2.0,Papier,Centre_Tri,"Feuilles et cartons collectés au Centre de Tri. Masse totale 16.2 kg. Matériau léger, souple et opaque. Aucune anomalie signalée.",0.8123459209276889,4.408135927853682
60.11946423970996,140.31311895563346,,1.0,8.0,Métal,Collecte_Citoyenne,"Déchets métalliques triés lors d'une collecte citoyenne. Poids 60.1 kg. Conductivité mesurée : non mesurée. Matériau dense et résistant. État dégradé, recyclage partiel possible.",18.035839271912987,6.346316586397982
65.84400592191851,,0.9723027414453788,,8.0,Métal,Collecte_Citoyenne,"Déchet métallique détecté via la collecte citoyenne. Poids 65.8 kg, volume non mesuré L. Conductivité élevée (0.972), rigidité importante. Volume surestimé, vérification recommandée.",19.75320177657555,6.346316586397982
168.7745917202945,334.4378695501523,0.0,55.0,9.0,Verre,Usine_A,Lot de verre trié provenant de l'Usine A. Masse 168.8 kg. Matériau lourd et extrêmement rigide. Aspect très opaque. Conditionnement non conforme au protocole.,5.063237751608835,2.563820160516839
157.9258825487151,319.9252067952921,,0.1764832736814677,10.0,Verre,Usine_A,"Déchets en verre identifiés en provenance de l'Usine A. Poids 157.9 kg, volume 319.9 L. Non conducteur, très rigide. Nécessite manipulation avec précaution.",4.737776476461453,63.298412670992946
