Poids,Volume,Conductivite,Opacite,Rigidite,Categorie,Source,Rapport_Collecte,Prix_Revente_Reel,Prix_Revente_Predit
228.8584663671388,430.1149035699797,0.0,0.172472741749349,8.0,Verre,Centre_Tri,"Déchet en verre collecté au centre de tri municipal. Poids lourd : 228.9 kg, volume 430.1 L. Très rigide, non conducteur, aspect légèrement translucide.",6.865753991014163,34.96463776410255
11.556666225185284,21.86019332632168,0.0,1.0,3.0,Papier,Centre_Tri,"Papier usagé au centre de tri municipal. Poids relevé : 11.6 kg. Faible rigidité, non conducteur. Poids anormalement élevé pour cette catégorie.",0.5778333112592642,0.3970737209698968
29.30421791078773,76.40818706591747,0.0,0.3865197651759275,3.0,Plastique,Collecte_Citoyenne,"Emballages plastiques récupérés lors d'une collecte citoyenne. Masse 29.3 kg, volume 76.4 L. semi-rigide, non conducteur.",2.930421791078774,6.346316586397982
,112.85112665043069,0.8409089186338927,1.0,8.0,Métal,Collecte_Citoyenne,"Métal de récupération issu de la collecte citoyenne. Masse non mesuré kg. Forte conductivité (0.841), rigidité élevée. Bonne valeur marchande.",15.764134352973205,6.346316586397982
188.65961792422453,378.8147612068884,0.0,0.0930019035052855,10.0,Verre,Usine_B,"Bris de verre ou contenants en provenance de l'Usine B. Masse 188.7 kg. Matériau dense, rigidité élevée, transparence partielle. Lot conforme aux standards de tri.",5.659788537726736,7.228197513531615
29.26027136405622,57.00723064159583,0.0,0.3731085937367275,3.0,Plastique,Centre_Tri,"Lot plastique au Centre de Tri. Volume 57.0 L, poids 29.3 kg. Aspect légèrement translucide, rigidité moyenne. Aucune trace de métal.",2.9260271364056223,6.346316586397982
39.87493005700723,95.0339478740526,0.0,0.2349160718358701,,Plastique,Usine_A,"Déchets plastiques divers provenant de l'Usine A. Poids estimé 39.9 kg. Opacité légèrement translucide, souplesse variable. Traces d'humidité détectées.",3.9874930057007214,6.346316586397982
30.965452635387752,31.934167044304616,,,3.0,Plastique,Usine_B,"Plastique de tri sélectif à l'Usine B. Masse 31.0 kg. Matériau semi-rigide, faible conductivité. Lot conforme aux standards de tri.",3.096545263538776,2.335254379514198
21.59382307863597,44.924829420508,0.0,,3.0,Papier,Usine_B,"Lot de papier récupéré depuis l'Usine B. Poids léger de 21.6 kg, volume petit. Matériau souple, non conducteur, aspect indéterminée. Bon état général.",1.0796911539317986,5.599756230788022
,158.3529208583135,0.8392491433412331,1.0,10.0,Métal,Centre_Tri,Déchets métalliques triés au centre de tri municipal. Poids non mesuré kg. Conductivité mesurée : 0.839. Matériau dense et résistant. Conditionnement non conforme au protocole.,22.70362956692885,11.651343582266561
17.762665761737203,41.43634054305746,0.0,1.0,1.0,Papier,Usine_B,"Papier usagé en provenance de l'Usine B. Poids relevé : 17.8 kg. Faible rigidité, non conducteur. Aucune anomalie signalée.",0.8881332880868602,-28.892393936462422
138.909054609448,268.3346228902979,0.0,0.0836799577335305,10.0,Verre,Usine_B,"Déchet en verre collecté depuis l'Usine B. Poids lourd : 138.9 kg, volume 268.3 L. Très rigide, non conducteur, aspect légèrement translucide.",4.16727163828344,7.3987359225736276
12.471718200312797,13.491703123699216,0.0,1.0,2.0,Papier,Collecte_Citoyenne,"Feuilles et cartons collectés lors d'une collecte citoyenne. Masse totale 12.5 kg. Matériau léger, souple et opaque. Acheminement prioritaire demandé.",0.6235859100156398,0.3970737209698968
72.8408883524556,164.8375714076485,0.9652976180391524,1.0,9.0,Métal,Centre_Tri,"Lot métallique au centre de tri municipal. Poids 72.8 kg, volume 164.8 L. Conducteur, très rigide. Aspect très opaque. Lot conforme aux standards de tri.",21.85226650573668,105.28640154689711
66.14120126803695,145.04186793908937,0.904252062436083,1.0,10.0,Métal,Centre_Tri,"Ferraille ou métal collecté au Centre de Tri. Masse 66.1 kg. Haute conductivité électrique, matériau extrêmement rigide. Prix revente estimé.",19.842360380411083,11.651343582266561
7.427648454096165,21.2871611349771,0.0,,3.0,Papier,Usine_B,"Déchet de type papier identifié à l'Usine B. Volume estimé 21.3 L, poids 7.4 kg. Texture semi-rigide, indéterminée.",0.3713824227048082,0.3970737209698968
256.3814500021342,521.024030679992,0.0,0.1587487700761032,10.0,Verre,Usine_A,"Déchets en verre identifiés en provenance de l'Usine A. Poids 256.4 kg, volume 521.0 L. Non conducteur, très rigide. Nécessite manipulation avec précaution.",7.691443500064026,91.59588658652231
62.97127141151783,123.0553345845568,0.8410279280964015,1.0,7.0,Métal,Usine_A,"Déchets métalliques triés en provenance de l'Usine A. Poids 63.0 kg. Conductivité mesurée : 0.841. Matériau dense et résistant. Volume surestimé, vérification recommandée.",18.891381423455343,6.346316586397982
21.690576082238405,75.10862976765713,0.0,1.0,,Papier,Centre_Tri,"Lot de papier récupéré au Centre de Tri. Poids léger de 21.7 kg, volume moyen. Matériau souple, non conducteur, aspect très opaque. Bon état général.",1.0845288041119203,8.119274958736018
,81.4990650909041,0.9209907845381082,1.0,9.0,Métal,Centre_Tri,"Métal de récupération au Centre de Tri. Masse non mesuré kg. Forte conductivité (0.921), rigidité élevée. Bonne valeur marchande.",13.544881936621822,6.346316586397982
30.8079162972198,47.99472938214601,0.0,0.4380918930877606,3.0,Plastique,Usine_B,"Emballages plastiques récupérés depuis l'Usine B. Masse 30.8 kg, volume 48.0 L. semi-rigide, non conducteur.",3.0807916297219795,6.346316586397982
,50.88239986800306,,0.2492013180494982,3.0,Plastique,Usine_B,"Déchet plastique collecté depuis l'Usine B. Poids non mesuré kg, volume 50.9 L. Rigidité semi-rigide, non conducteur. Surface légèrement translucide.",2.4512750922590385,6.346316586397982
55.874224542725344,65.710025790739,0.9236509543060591,,9.0,Métal,Collecte_Citoyenne,Déchets métalliques triés issu de la collecte citoyenne. Poids 55.9 kg. Conductivité mesurée : 0.924. Matériau dense et résistant. Matériau mélangé à d'autres déchets.,16.762267362817603,72.56586591290093
157.9258825487151,319.9252067952921,,0.1764832736814677,10.0,Verre,Usine_A,"Déchets en verre identifiés provenant de l'Usine A. Poids 157.9 kg, volume 319.9 L. Non conducteur, très rigide. Nécessite manipulation avec précaution.",4.737776476461453,11.651343582266561
217.14713821939296,416.7544245485749,,,,Verre,,Lot de verre trié à l'emplacement non spécifié. Masse 217.1 kg. Matériau lourd et de rigidité non mesurée. Aspect indéterminée. Légère contamination observée.,6.514414146581789,34.96463776410255
5.076437970970989,-9.49192564252175,0.0,0.5982551334379234,4.0,Plastique,Centre_Tri,"Emballages plastiques récupérés au centre de tri municipal. Masse 5.1 kg, volume -9.5 L. semi-rigide, non conducteur.",0.507643797097099,0.3970737209698968
175.02830840560154,333.54491995085385,0.0,0.1758236615124329,9.0,,Centre_Tri,"Déchet non catégorisé collecté au Centre de Tri. Poids 175.0 kg, volume 333.5 L. Caractéristiques ambiguës. Nécessite analyse complémentaire.",5.250849252168046,2.563820160516839
193.30505161753567,363.572735543336,0.0,0.0445352158246169,,Verre,Usine_A,"Bris de verre ou contenants à l'Usine A. Masse 193.3 kg. Matériau dense, rigidité élevée, transparence partielle. Conditionnement non conforme au protocole.",5.799151548526073,11.94442000383283
203.45397933938736,418.26169369746646,0.0,0.0626323989634564,9.0,Verre,,"Verre recyclable sans localisation enregistrée. Poids 203.5 kg, volume 418.3 L. Rigidité extrêmement rigide, faible conductivité. Surface lisse.",6.1036193801816205,-1.859325908218092
18.36566010344856,-10.67372939441912,0.0,1.0,3.0,Papier,Collecte_Citoyenne,"Lot de papier récupéré via la collecte citoyenne. Poids léger de 18.4 kg, volume petit. Matériau souple, non conducteur, aspect très opaque. Bon état général.",0.918283005172428,4.10821275185223
25.214327579838866,69.58320823291791,0.0,0.4774472229895181,4.0,Plastique,Centre_Tri,"Emballages plastiques récupérés depuis le Centre de Tri. Masse 25.2 kg, volume 69.6 L. semi-rigide, non conducteur.",2.521432757983886,6.346316586397982
163.333596615394,330.7549738628476,0.0,0.0790518630862315,10.0,Verre,Usine_B,"Lot de verre trié depuis l'Usine B. Masse 163.3 kg. Matériau lourd et extrêmement rigide. Aspect légèrement translucide. État dégradé, recyclage partiel possible.",4.90000789846182,211.84843639368813
47.28855461823081,105.3532334715007,0.9944839998080206,1.0,,Métal,Usine_A,Déchets métalliques triés à l'Usine A. Poids 47.3 kg. Conductivité mesurée : 0.994. Matériau dense et résistant. Aucune anomalie signalée.,14.186566385469243,6.346316586397982
12.240709270537767,75.64540425444058,,1.0,2.0,Papier,Collecte_Citoyenne,"Collecte de déchets papier lors d'une collecte citoyenne. Masse 12.2 kg. Matériau souple, sans conductivité électrique. Surface très opaque.",0.6120354635268884,4.408135927853682
42.87982473801938,,0.0,0.2816142538515595,4.0,Plastique,Collecte_Citoyenne,"Plastique de tri sélectif lors d'une collecte citoyenne. Masse 42.9 kg. Matériau semi-rigide, faible conductivité. Matériau mélangé à d'autres déchets.",4.2879824738019385,6.346316586397982
214.46297101116312,394.13166644676426,0.0,0.0327047745170045,10.0,Verre,Centre_Tri,Lot de verre trié depuis le Centre de Tri. Masse 214.5 kg. Matériau lourd et extrêmement rigide. Aspect légèrement translucide. Lot conforme aux standards de tri.,6.433889130334894,7.228197513531615
35.99783855964729,94.6666126093487,0.0,0.596853326536269,4.0,Plastique,Usine_A,"Emballages plastiques récupérés à l'Usine A. Masse 36.0 kg, volume 94.7 L. semi-rigide, non conducteur.",3.5997838559647293,6.346316586397982
17.565528990880413,29.94012443008248,0.0,,2.0,,Usine_B,"Déchet non catégorisé collecté depuis l'Usine B. Poids 17.6 kg, volume 29.9 L. Caractéristiques ambiguës. Nécessite analyse complémentaire.",0.8782764495440207,-25.48723112119635
22.752502464070385,25.53792411336495,0.0,,3.0,Papier,Usine_A,"Papier usagé provenant de l'Usine A. Poids relevé : 22.8 kg. Faible rigidité, non conducteur. Traces d'humidité détectées.",1.1376251232035193,2.335254379514198
199.7773700529721,418.3061428584755,0.0,0.0100452022927947,9.0,Verre,Centre_Tri,"Verre recyclable au Centre de Tri. Poids 199.8 kg, volume 418.3 L. Rigidité extrêmement rigide, faible conductivité. Surface lisse.",5.9933211015891645,-1.859325908218092
27.748534726499788,59.44864789402773,0.0,0.5448057929090491,5.0,Plastique,Collecte_Citoyenne,"Déchet plastique collecté lors d'une collecte citoyenne. Poids 27.7 kg, volume 59.4 L. Rigidité rigide, non conducteur. Surface semi-opaque.",2.774853472649979,6.346316586397982
13.206953402712289,9.932729974644342,0.0,1.0,3.0,Papier,Usine_A,"Collecte de déchets papier provenant de l'Usine A. Masse 13.2 kg. Matériau semi-rigide, sans conductivité électrique. Surface très opaque.",0.6603476701356145,0.3970737209698968
17.580623642888455,44.67112011476039,0.0,,1.0,Papier,Usine_A,"Lot de papier récupéré provenant de l'Usine A. Poids léger de 17.6 kg, volume petit. Matériau souple, non conducteur, aspect indéterminée. Bon état général.",0.8790311821444228,233.3740008084419
178.81334538430036,371.2567047160532,0.0,0.1724085301978627,10.0,Verre,Usine_B,"Déchet en verre collecté à l'Usine B. Poids lourd : 178.8 kg, volume 371.3 L. Très rigide, non conducteur, aspect légèrement translucide.",9999.0,2687.576601568754
128.43747321413505,,0.0,0.0666069743610796,9.0,Verre,Usine_B,Lot de verre trié en provenance de l'Usine B. Masse 128.4 kg. Matériau lourd et extrêmement rigide. Aspect légèrement translucide. Étiquetage absent sur le conteneur.,3.853124196424052,2.0937089267050517
10.489568670741289,42.19199595120588,0.0,1.0,2.0,Papier,Collecte_Citoyenne,"Collecte de déchets papier lors d'une collecte citoyenne. Masse 10.5 kg. Matériau souple, sans conductivité électrique. Surface très opaque.",0.5244784335370645,0.3970737209698968
41.037837974585074,60.20694430724191,0.8244223031848577,1.0,9.0,Métal,Collecte_Citoyenne,"Lot métallique lors d'une collecte citoyenne. Poids 41.0 kg, volume 60.2 L. Conducteur, très rigide. Aspect très opaque. Odeur inhabituelle signalée par l'agent.",12.311351392375522,6.346316586397982
228.36661884766272,474.6700240126361,,0.022897527613181,9.0,Verre,Collecte_Citoyenne,"Déchet en verre collecté lors d'une collecte citoyenne. Poids lourd : 228.4 kg, volume 474.7 L. Très rigide, non conducteur, aspect légèrement translucide.",6.850998565429881,-1.859325908218092
176.97531029444377,383.9219173661891,,0.0081508212184945,9.0,Verre,Centre_Tri,"Bris de verre ou contenants au centre de tri municipal. Masse 177.0 kg. Matériau dense, rigidité élevée, transparence partielle. Acheminement prioritaire demandé.",5.309259308833313,5.619771706738918
43.6209914940703,105.04693300487078,0.9878136958900584,1.0,8.0,Métal,Collecte_Citoyenne,"Ferraille ou métal collecté via la collecte citoyenne. Masse 43.6 kg. Haute conductivité électrique, matériau extrêmement rigide. Prix revente estimé.",13.08629744822109,6.346316586397982
42.87982473801938,77.3034102543279,0.0,0.2816142538515595,4.0,,Collecte_Citoyenne,"Matériau inconnu lors d'une collecte citoyenne. Poids 42.9 kg, volume 77.3 L. Propriétés mixtes. Orientation vers tri manuel.",4.2879824738019385,6.346316586397982
54.09585843977109,137.58769540508794,0.841243481016828,1.0,9.0,Métal,Centre_Tri,"Métal de récupération au centre de tri municipal. Masse 54.1 kg. Forte conductivité (0.841), rigidité élevée. Bonne valeur marchande.",16.228757531931326,6.346316586397982
,34.16792369617481,0.0,0.4709549286074867,3.0,Plastique,Collecte_Citoyenne,"Plastique de tri sélectif via la collecte citoyenne. Masse non mesuré kg. Matériau semi-rigide, faible conductivité. État dégradé, recyclage partiel possible.",3.030495504753598,12.50182944479775
196.0351694544165,409.82344742630977,0.0,0.1428653271469995,10.0,,Collecte_Citoyenne,Déchet inclassifiable détecté via la collecte citoyenne. Masse estimée 196.0 kg. Agent de tri recommande contrôle visuel supplémentaire. Poids anormalement élevé pour cette catégorie.,5.881055083632496,7.228197513531615
37.57662872939976,75.00295017338395,0.0,0.3756382261003314,4.0,Plastique,Usine_A,"Plastique de tri sélectif en provenance de l'Usine A. Masse 37.6 kg. Matériau semi-rigide, faible conductivité. Poids anormalement élevé pour cette catégorie.",3.757662872939976,6.346316586397982
167.3881463291512,362.02863319056974,0.0,0.174744584036445,10.0,Verre,Usine_A,"Déchet en verre collecté à l'Usine A. Poids lourd : 167.4 kg, volume 362.0 L. Très rigide, non conducteur, aspect légèrement translucide.",5.021644389874536,65.33500471286014
30.85840396726503,50.11624788476127,0.0,0.3135313788094081,4.0,Plastique,Usine_A,"Plastique de tri sélectif en provenance de l'Usine A. Masse 30.9 kg. Matériau semi-rigide, faible conductivité. Conditionnement non conforme au protocole.",3.085840396726504,176.8284127450569
17.290840573943495,14.987256653550856,,1.0,1.0,Papier,Usine_A,"Lot de papier récupéré provenant de l'Usine A. Poids léger de 17.3 kg, volume petit. Matériau souple, non conducteur, aspect très opaque. Bon état général.",0.8645420286971748,349.3282302631826
96.7418969843715,169.9577288302776,0.8608060544895999,1.0,7.0,Métal,Usine_A,"Métal de récupération provenant de l'Usine A. Masse 96.7 kg. Forte conductivité (0.861), rigidité élevée. Bonne valeur marchande.",29.022569095311447,6.346316586397982
11.67073295883038,19.958442402794347,0.0,1.0,,Papier,Usine_B,"Collecte de déchets papier à l'Usine B. Masse 11.7 kg. Matériau de rigidité non mesurée, sans conductivité électrique. Surface très opaque.",0.583536647941519,0.3970737209698968
9.386745440588584,29.79322403260344,0.0,,4.0,Plastique,Centre_Tri,"Plastique de tri sélectif depuis le Centre de Tri. Masse 9.4 kg. Matériau semi-rigide, faible conductivité. Traces d'humidité détectées.",0.9386745440588584,0.3970737209698968
63.46415934582245,112.6088025531208,0.9471809226392004,1.0,7.0,Métal,Usine_A,"Lot métallique provenant de l'Usine A. Poids 63.5 kg, volume 112.6 L. Conducteur, très rigide. Aspect très opaque. Conditionnement non conforme au protocole.",19.039247803746736,6.346316586397982
74.55590084770277,165.1791026718288,0.820503192813295,1.0,7.0,Métal,Usine_A,Déchets métalliques triés provenant de l'Usine A. Poids 74.6 kg. Conductivité mesurée : 0.821. Matériau dense et résistant. Acheminement prioritaire demandé.,22.36677025431084,6.346316586397982
232.9712779935121,453.3848916981884,0.0,0.0916044423336517,10.0,Verre,Usine_B,"Déchets en verre identifiés à l'Usine B. Poids 233.0 kg, volume 453.4 L. Non conducteur, très rigide. Nécessite manipulation avec précaution.",6.989138339805363,7.228197513531615
41.18881620298399,119.05608544984364,0.0,0.2473660156703727,4.0,,,"Lot de déchets non identifiés sans localisation enregistrée. Masse 41.2 kg. Comportement physique atypique, classification incertaine. Matériau mélangé à d'autres déchets.",4.118881620298398,6.346316586397982
137.8452023290662,285.7110715284793,,0.0241133771554557,9.0,Verre,Collecte_Citoyenne,"Déchets en verre identifiés lors d'une collecte citoyenne. Poids 137.8 kg, volume 285.7 L. Non conducteur, très rigide. Nécessite manipulation avec précaution.",4.135356069871986,2.0937089267050517
15.33214809384323,20.636253249973727,0.0,0.4689535373166814,3.0,Plastique,Collecte_Citoyenne,"Déchet plastique collecté via la collecte citoyenne. Poids 15.3 kg, volume 20.6 L. Rigidité semi-rigide, non conducteur. Surface semi-opaque.",1.5332148093843232,0.3970737209698968
20.21304417818244,30.0290205253898,0.0,1.0,2.0,Papier,Centre_Tri,"Déchet de type papier identifié depuis le Centre de Tri. Volume estimé 30.0 L, poids 20.2 kg. Texture souple, très opaque.",1.010652208909122,2.335254379514198
176.9146751059179,353.29346327912253,0.0,0.0488294580844748,9.0,Verre,Usine_B,"Verre recyclable en provenance de l'Usine B. Poids 176.9 kg, volume 353.3 L. Rigidité extrêmement rigide, faible conductivité. Surface lisse.",5.307440253177536,-1.688787499176092
,96.07788239753792,0.9106742379499544,1.0,,Métal,Centre_Tri,"Déchet métallique détecté au Centre de Tri. Poids non mesuré kg, volume 96.1 L. Conductivité élevée (0.911), rigidité importante. Volume surestimé, vérification recommandée.",16.96590166241163,6.346316586397982
224.07070192622305,440.98252722441975,0.0,0.1705169909876685,8.0,Verre,Usine_B,"Lot de verre trié depuis l'Usine B. Masse 224.1 kg. Matériau lourd et extrêmement rigide. Aspect légèrement translucide. État dégradé, recyclage partiel possible.",6.722121057786691,361.8498897251542
23.428241507095827,37.65057413031472,0.0,1.0,3.0,Papier,,"Lot de papier récupéré à l'emplacement non spécifié. Poids léger de 23.4 kg, volume petit. Matériau souple, non conducteur, aspect très opaque. Bon état général.",1.1714120753547914,4.10821275185223
129.45643815538614,240.2384312559678,0.0,0.1335186771127169,9.0,Verre,Usine_B,"Bris de verre ou contenants en provenance de l'Usine B. Masse 129.5 kg. Matériau dense, rigidité élevée, transparence partielle. Aucune anomalie signalée.",3.883693144661584,2.4231009927527523
22.242852868556326,17.32988783195512,0.8988295341275766,1.0,8.0,Métal,Usine_B,"Lot métallique à l'Usine B. Poids 22.2 kg, volume 17.3 L. Conducteur, très rigide. Aspect très opaque. Aucune anomalie signalée.",6.672855860566898,-86.21489392246171
18.279503882648804,40.4537316596731,0.0,,2.0,Papier,Usine_A,"Déchet de type papier identifié provenant de l'Usine A. Volume estimé 40.5 L, poids 18.3 kg. Texture souple, indéterminée.",0.9139751941324402,2.335254379514198
181.87508199748427,348.1406838684617,0.0,0.17650669716392,9.0,Verre,Collecte_Citoyenne,"Déchet en verre collecté via la collecte citoyenne. Poids lourd : 181.9 kg, volume 348.1 L. Très rigide, non conducteur, aspect légèrement translucide.",5.456252459924528,1.5568852712172558
32.95477524423183,43.962633117130494,0.0,0.3523563426524086,4.0,Plastique,Usine_B,"Déchet plastique collecté depuis l'Usine B. Poids 33.0 kg, volume 44.0 L. Rigidité semi-rigide, non conducteur. Surface légèrement translucide.",3.2954775244231835,174.21863532033373
164.90564244295257,358.69121819739604,0.0,,8.0,Verre,Collecte_Citoyenne,"Déchet en verre collecté via la collecte citoyenne. Poids lourd : 164.9 kg, volume 358.7 L. Très rigide, non conducteur, aspect indéterminée.",4.947169273288577,989.2172310421805
19.906570639993905,64.5273760659646,0.0,1.0,3.0,Papier,Collecte_Citoyenne,"Papier usagé lors d'une collecte citoyenne. Poids relevé : 19.9 kg. Faible rigidité, non conducteur. Odeur inhabituelle signalée par l'agent.",0.9953285319996952,6.346316586397982
17.565528990880413,29.94012443008248,0.0,1.0,2.0,Papier,Usine_B,"Lot de papier récupéré en provenance de l'Usine B. Poids léger de 17.6 kg, volume petit. Matériau souple, non conducteur, aspect très opaque. Bon état général.",0.8782764495440207,114.41334260627538
185.2445330642633,373.782169235698,0.0,0.1496711707331479,8.0,Verre,Usine_A,"Bris de verre ou contenants provenant de l'Usine A. Masse 185.2 kg. Matériau dense, rigidité élevée, transparence partielle. Acheminement prioritaire demandé.",5.557335991927899,-1.859325908218092
21.77378584510899,40.54073323859991,0.0,0.5262994574017124,3.0,Plastique,Collecte_Citoyenne,"Plastique de tri sélectif issu de la collecte citoyenne. Masse 21.8 kg. Matériau semi-rigide, faible conductivité. Acheminement prioritaire demandé.",2.177378584510899,2.335254379514198
-99.0,393.0790307230503,0.0,0.0060774119393673,8.0,,Collecte_Citoyenne,"Déchet non catégorisé collecté via la collecte citoyenne. Poids -99.0 kg, volume 393.1 L. Caractéristiques ambiguës. Nécessite analyse complémentaire.",5.580989142043471,7.464087474075758
65.49897369145272,112.20035165635834,0.836376016879829,1.0,10.0,Métal,Usine_B,"Déchet métallique détecté à l'Usine B. Poids 65.5 kg, volume 112.2 L. Conductivité élevée (0.836), rigidité importante. Matériau mélangé à d'autres déchets.",19.64969210743581,11.651343582266561
14.975876890474348,45.41202102602493,0.0,1.0,1.0,Papier,Collecte_Citoyenne,"Lot de papier récupéré issu de la collecte citoyenne. Poids léger de 15.0 kg, volume petit. Matériau souple, non conducteur, aspect très opaque. Bon état général.",0.7487938445237174,14.548593899470267
47.61188124867374,95.217489045112,,0.4476690941463347,3.0,Plastique,Usine_A,"Lot plastique à l'Usine A. Volume 95.2 L, poids 47.6 kg. Aspect semi-opaque, rigidité moyenne. Aucune trace de métal.",4.761188124867374,6.346316586397982
,380.85022610624,0.0,0.1554910934364771,10.0,Verre,,"Déchets en verre identifiés sans localisation enregistrée. Poids non mesuré kg, volume 380.9 L. Non conducteur, très rigide. Nécessite manipulation avec précaution.",5.344101603071834,14.707295128488624
81.2137689391862,152.95576225883022,0.8024406144636089,1.0,9.0,Métal,Usine_A,"Déchet métallique détecté à l'Usine A. Poids 81.2 kg, volume 153.0 L. Conductivité élevée (0.802), rigidité importante. Poids anormalement élevé pour cette catégorie.",24.364130681755857,6.346316586397982
8.487703821293305,52.34137381052205,0.0,0.2058668228185055,5.0,Plastique,Centre_Tri,"Déchets plastiques divers depuis le Centre de Tri. Poids estimé 8.5 kg. Opacité légèrement translucide, souplesse variable. Légère contamination observée.",0.8487703821293305,4.408135927853682
9.386745440588584,29.79322403260344,0.0,,4.0,Plastique,Centre_Tri,"Déchet plastique collecté au centre de tri municipal. Poids 9.4 kg, volume 29.8 L. Rigidité semi-rigide, non conducteur. Surface indéterminée.",0.9386745440588584,0.3970737209698968
196.3044945889133,413.3074077194386,0.0,0.1046130849538238,8.0,Verre,Usine_A,"Déchet en verre collecté provenant de l'Usine A. Poids lourd : 196.3 kg, volume 413.3 L. Très rigide, non conducteur, aspect légèrement translucide.",5.889134837667399,-1.859325908218092
30.49053409274357,56.36705992157758,0.0,0.3459192876578117,5.0,Plastique,Collecte_Citoyenne,"Plastique de tri sélectif issu de la collecte citoyenne. Masse 30.5 kg. Matériau rigide, faible conductivité. Odeur inhabituelle signalée par l'agent.",3.0490534092743573,6.346316586397982
13.153614303768984,29.17499795438299,0.0,,1.0,Papier,Usine_B,"Lot de papier récupéré depuis l'Usine B. Poids léger de 13.2 kg, volume petit. Matériau souple, non conducteur, aspect indéterminée. Bon état général.",0.6576807151884493,8.018012964638492
37.94264679621827,50.79950512905155,0.0,0.2792390531038961,3.0,Plastique,Usine_A,"Déchet plastique collecté en provenance de l'Usine A. Poids 37.9 kg, volume 50.8 L. Rigidité semi-rigide, non conducteur. Surface légèrement translucide.",3.7942646796218273,6.346316586397982
91.57803601812016,160.89498349496608,0.9262615106183978,1.0,10.0,Métal,Centre_Tri,Déchets métalliques triés au centre de tri municipal. Poids 91.6 kg. Conductivité mesurée : 0.926. Matériau dense et résistant. Acheminement prioritaire demandé.,27.47341080543605,11.651343582266561
39.32996642650568,87.09363133125655,0.0,0.5469176803839209,3.0,Plastique,Usine_A,"Déchet plastique collecté à l'Usine A. Poids 39.3 kg, volume 87.1 L. Rigidité semi-rigide, non conducteur. Surface semi-opaque.",3.932996642650568,6.346316586397982
21.746625314729226,76.72207090402637,0.0,1.0,1.0,Papier,Usine_B,"Collecte de déchets papier à l'Usine B. Masse 21.7 kg. Matériau souple, sans conductivité électrique. Surface très opaque.",1.087331265736461,14.713816185676535
